{
  "$schema": "http://json-schema.org/draft-07/schema#",
  "$id": "smoke-style/1",
  "title": "Smoke Style",
  "description": "Renderer-agnostic style preset for stylized smoke. Every control is normalized to 0..1 (except hueShift in degrees and colors in hex) so the same file can drive the 2D canvas renderer, the 3D raymarch renderer, or future exporters. Each renderer owns its own mapping from these values to internal units.",
  "type": "object",
  "required": ["schema", "color", "motion", "shading", "layers"],
  "properties": {
    "schema": { "const": "smoke-style/1" },
    "name": { "type": "string", "default": "Untitled" },
    "notes": { "type": "string", "description": "Free text: references, intent, source shots." },

    "emission": {
      "type": "object",
      "properties": {
        "mode": { "enum": ["brush", "livingStroke"], "default": "brush", "description": "brush = smoke is injected once and drifts away; livingStroke = the drawn line is a persistent source held at a fixed density." },
        "radius": { "type": "number", "minimum": 0, "maximum": 1, "default": 0.3, "description": "Stroke thickness. 2D: 1.2-3 cells. 3D: 1.2-3 voxels." }
      }
    },

    "color": {
      "type": "object",
      "required": ["base"],
      "properties": {
        "base": { "type": "string", "pattern": "^#[0-9a-fA-F]{6}$", "default": "#8a8f99", "description": "Mid tone. Light, shadow, mottle, haze and AO colors are derived from it in HSL." },
        "hueShift": { "type": "number", "minimum": 0, "maximum": 40, "default": 20, "description": "Degrees. Lights rotate +hueShift (warmer), shadows rotate -1.3*hueShift (cooler) and gain a minimum saturation so grey smoke still gets tinted shadows." },
        "background": { "type": "string", "pattern": "^#[0-9a-fA-F]{6}$", "default": "#000000" }
      }
    },

    "shading": {
      "type": "object",
      "properties": {
        "bands": { "type": "integer", "minimum": 2, "maximum": 4, "default": 3, "description": "Number of flat tone bands (light / mid / shadow)." },
        "silhouetteThreshold": { "type": "number", "minimum": 0, "maximum": 1, "default": 0.11, "description": "Density above which a pixel is part of the graphic smoke shape. Below it only haze is drawn." },
        "shadowThreshold": { "type": "number", "minimum": 0, "maximum": 1, "default": 0.42, "description": "Occlusion toward the light above which the shadow band is used." },
        "lightDirection": { "type": "array", "items": { "type": "number" }, "minItems": 3, "maxItems": 3, "default": [-0.5, 0.85, 0.3], "description": "Direction TOWARD the light, y up. 2D renderers ignore z." },
        "opacity": { "type": "number", "minimum": 0, "maximum": 1, "default": 0.92 }
      }
    },

    "texture": {
      "type": "object",
      "properties": {
        "amount": { "type": "number", "minimum": 0, "maximum": 1, "default": 0.5, "description": "Strength of the flow-advected brush texture on edges and band boundaries." },
        "mottle": { "type": "boolean", "default": true, "description": "Tint parts of mid and shadow bands toward two hue-rotated side colors (+38 and -48 degrees)." }
      }
    },

    "motion": {
      "type": "object",
      "properties": {
        "rise": { "type": "number", "minimum": 0, "maximum": 1, "default": 0.5, "description": "Buoyancy. 2D: acceleration 0.008*rise per frame with drag. 3D: rise speed 1.0*rise voxels per frame." },
        "curl": { "type": "number", "minimum": 0, "maximum": 1, "default": 0.4, "description": "Swirl strength. 2D: vorticity confinement 0.4*curl. 3D: curl-noise gain." },
        "dissipation": { "type": "number", "minimum": 0, "maximum": 1, "default": 0.4, "description": "How fast aged smoke fades. Extra per-frame decay = 0.025*dissipation, ramped in over agingFrames." },
        "agingFrames": { "type": "integer", "minimum": 1, "default": 80, "description": "Frames after leaving the source before age-based fading reaches full strength." }
      }
    },

    "form": {
      "type": "object",
      "properties": {
        "solidity": { "type": "number", "minimum": 0, "maximum": 1, "default": 0.4, "description": "Blend toward blurred density for the silhouette (like EmberGen smoke dilate). Higher = fuller, simpler shapes." }
      }
    },

    "layers": {
      "type": "object",
      "properties": {
        "haze": { "type": "boolean", "default": true },
        "ageTint": { "type": "boolean", "default": true, "description": "Fresh smoke warmer and lighter, old smoke cooler and greyer." },
        "ambientOcclusion": { "type": "boolean", "default": true, "description": "Darken crevices where local density is below its neighborhood average." },
        "emberCore": { "type": "boolean", "default": true, "description": "Glowing veins and red-brown shadows in fresh, dense smoke." }
      }
    },

    "embers": {
      "type": "object",
      "properties": {
        "enabled": { "type": "boolean", "default": true },
        "amount": { "type": "number", "minimum": 0, "maximum": 1, "default": 0.4 },
        "matchSmoke": { "type": "boolean", "default": false, "description": "Use the smoke palette instead of fixed hot / orange / dark red." }
      }
    },

    "timing": {
      "type": "object",
      "properties": {
        "frameStep": { "type": "integer", "minimum": 1, "maximum": 4, "default": 2, "description": "Render on 1s, 2s, 3s or 4s." }
      }
    }
  }
}
